{
  "v": 1,
  "msg_id": "20261021T0600Z-s1-nozzle_fault/line1/state/4812",
  "run_id": "20261021T0600Z-s1-nozzle_fault",
  "ts": "2026-10-21T08:41:07.500Z",
  "sim_time_s": 9667.5,
  "line": "line1",
  "station": "pnp",
  "state": "DOWN",
  "reason_code": "NOZZLE_CLOG",
  "category": "own_loss",
  "product": "CTRL-BOARD-A"
}
